{
  "appealList": [
    {
      "judge": "Judge name",
      "time": "10.30am",
      "venue": "This is venue name",
      "type": "This is hearing type",
      "caseNumber": "1234",
      "caseName": "This is case name",
      "additionalInformation": "This is additional information"
    },
    {
      "judge": "Judge name 2",
      "time": "11:30am",
      "venue": "This is venue name 2",
      "type": "This is hearing type 2",
      "caseNumber": "5678",
      "caseName": "This is case name 2",
      "additionalInformation": "This is additional information 2"
    },
    {
      "judge": "Judge name 3",
      "time": "12:30Pm",
      "venue": "This is venue name 3",
      "type": "This is hearing type 3",
      "caseNumber": "9012",
      "caseName": "This is case name 3",
      "additionalInformation": "This is additional information 3"
    }
  ],
  "businessList": [
    {
      "judge": "Judge name",
      "time": "10:30am",
      "venue": "This is venue name",
      "type": "This is hearing type",
      "caseNumber": "1234",
      "caseName": "This is case name",
      "additionalInformation": "This is additional information"
    },
    {
      "judge": "Judge name 2",
      "time": "11:30am",
      "venue": "This is venue name 2",
      "type": "This is hearing type 2",
      "caseNumber": "5678",
      "caseName": "This is case name 2",
      "additionalInformation": "This is additional information 2"
    }
  ],
  "commercialCourt": [
    {
      "judge": "Judge name",
      "time": "10:30am",
      "venue": "This is venue name",
      "type": "This is hearing type",
      "caseNumber": "1234",
      "caseName": "This is case name",
      "additionalInformation": "This is additional information"
    }
  ],
  "financialList": [
    {
      "judge": "Judge name",
      "time": "10:30am",
      "venue": "This is venue name",
      "type": "This is hearing type",
      "caseNumber": "1234",
      "caseName": "This is case name",
      "additionalInformation": "This is additional information"
    }
  ],
  "insolvency&CompaniesCourt": [
    {
      "judge": "Judge name",
      "time": "10:30am",
      "venue": "This is venue name",
      "type": "This is hearing type",
      "caseNumber": "1234",
      "caseName": "This is case name",
      "additionalInformation": "This is additional information"
    }
  ],
  "ip&EnterpriseCourt": [],
  "intellectualPropertyList": [
    {
      "judge": "Judge name",
      "time": "10:30am",
      "venue": "This is venue name",
      "type": "This is hearing type",
      "caseNumber": "1234",
      "caseName": "This is case name",
      "additionalInformation": "This is additional information"
    },
    {
      "judge": "Judge name 2",
      "time": "11:30am",
      "venue": "This is venue name 2",
      "type": "This is hearing type 2",
      "caseNumber": "5678",
      "caseName": "This is case name 2",
      "additionalInformation": "This is additional information 2"
    }
  ],
  "londonCircuitCommercialCourt": [
    {
      "judge": "Judge name",
      "time": "10:30am",
      "venue": "This is venue name",
      "type": "This is hearing type",
      "caseNumber": "1234",
      "caseName": "This is case name",
      "additionalInformation": "This is additional information"
    }
  ],
  "patentsCourt": [
    {
      "judge": "Judge name",
      "time": "10:30am",
      "venue": "This is venue name",
      "type": "This is hearing type",
      "caseNumber": "1234",
      "caseName": "This is case name",
      "additionalInformation": "This is additional information"
    }
  ],
  "property,Trusts&ProbateList": [
    {
      "judge": "Judge name",
      "time": "10:30am",
      "venue": "This is venue name",
      "type": "This is hearing type",
      "caseNumber": "1234",
      "caseName": "This is case name",
      "additionalInformation": "This is additional information"
    },
    {
      "judge": "Judge name 2",
      "time": "11:30am",
      "venue": "This is venue name 2",
      "type": "This is hearing type 2",
      "caseNumber": "5678",
      "caseName": "This is case name 2",
      "additionalInformation": "This is additional information 2"
    }
  ],
  "technology&ConstructionCourt": [
    {
      "judge": "Judge name",
      "time": "10:30am",
      "venue": "This is venue name",
      "type": "This is hearing type",
      "caseNumber": "1234",
      "caseName": "This is case name",
      "additionalInformation": "This is additional information"
    }
  ],
  "admiraltyCourt": [
    {
      "judge": "Judge name",
      "time": "10:30am",
      "venue": "This is venue name",
      "type": "This is hearing type",
      "caseNumber": "1234",
      "caseName": "This is case name",
      "additionalInformation": "This is additional information"
    }
  ],
  "companiesWindingUp": [
    {
      "judge": "Judge name",
      "time": "10:30am",
      "venue": "This is venue name",
      "type": "This is hearing type",
      "caseNumber": "1234",
      "caseName": "This is case name",
      "additionalInformation": "This is additional information"
    },
    {
      "judge": "Judge name 2",
      "time": "11:30am",
      "venue": "This is venue name 2",
      "type": "This is hearing type 2",
      "caseNumber": "5678",
      "caseName": "This is case name 2",
      "additionalInformation": "This is additional information 2"
    }
  ],
  "competitionList": [
    {
      "judge": "Judge name",
      "time": "10:30am",
      "venue": "This is venue name",
      "type": "This is hearing type",
      "caseNumber": "1234",
      "caseName": "This is case name",
      "additionalInformation": "This is additional information"
    }
  ],
  "pensionsList": [
    {
      "judge": "Judge name",
      "time": "10:30am",
      "venue": "This is venue name",
      "type": "This is hearing type",
      "caseNumber": "1234",
      "caseName": "This is case name",
      "additionalInformation": "This is additional information"
    }
  ],
  "revenueList": []
}
